{
  "authorized_record_count": 288,
  "blocked_reasons": [],
  "blocked_record_count": 0,
  "evaluated_at": "2026-07-21T00:00:00+00:00",
  "findings": [],
  "notes": [
    "Personal-data finding previews omit matched values.",
    "A passing receipt authorizes only the declared purpose and policy fingerprint."
  ],
  "passed": true,
  "pii_finding_count": 0,
  "policy": {
    "pii_policy": "block_unredacted",
    "purpose": "agent_training",
    "required_fields": [
      "owner",
      "tenant",
      "legal_basis",
      "allowed_purposes",
      "sensitivity",
      "jurisdiction",
      "retention_expires_at",
      "license",
      "provenance",
      "deletion_subject_ids"
    ],
    "unknown_license_allowed": false
  },
  "policy_fingerprint": "d59d67fb929204fcb8e40aa29c75c34f2d1ea35b561fc7777c260eb0511317b6",
  "policy_violations": [],
  "purpose": "agent_training",
  "record_count": 288,
  "record_statuses": [
    {
      "blocked_reasons": [],
      "governance_fingerprint": "306fa6aaa25eed4d37388915ad3937effea8080f11d162330bd1f591925688dd",
      "passed": true,
      "pii_finding_count": 0,
      "record_id": "rar-train-00000"
    },
    {
      "blocked_reasons": [],
      "governance_fingerprint": "ecae9efcc980c60170cc61b18fb4086a06b02ef5dfa6c12a280823a0cb4b3183",
      "passed": true,
      "pii_finding_count": 0,
      "record_id": "rar-train-00001"
    },
    {
      "blocked_reasons": [],
      "governance_fingerprint": "c8978e5c6ca1851b1c5c43d72c609208f02a86fc65cc3b82690ff1907c9c59a3",
      "passed": true,
      "pii_finding_count": 0,
      "record_id": "rar-train-00002"
    },
    {
      "blocked_reasons": [],
      "governance_fingerprint": "9b1ee2a4b73f7f9231b3785585f0a25124c0c0eed5a59571ca66a3ef739318c3",
      "passed": true,
      "pii_finding_count": 0,
      "record_id": "rar-train-00003"
    },
    {
      "blocked_reasons": [],
      "governance_fingerprint": "815476af0bf6d5a29f50c6aabcecb6f814883e49a2ffa3b4afbc497abb2d4e85",
      "passed": true,
      "pii_finding_count": 0,
      "record_id": "rar-train-00004"
    },
    {
      "blocked_reasons": [],
      "governance_fingerprint": "2178b25cdfcf772be6ee8235fd06f024b8d447a86c9b4a9097685b167cfb244d",
      "passed": true,
      "pii_finding_count": 0,
      "record_id": "rar-train-00005"
    },
    {
      "blocked_reasons": [],
      "governance_fingerprint": "9ee9f860142166aa1731c3d6f45a8762a1bc9b92d9278790b90c041164fdb152",
      "passed": true,
      "pii_finding_count": 0,
      "record_id": "rar-train-00006"
    },
    {
      "blocked_reasons": [],
      "governance_fingerprint": "cb09bacad607a150d388559ba32f03f3f37905c99a537dc3cff93113450119c7",
      "passed": true,
      "pii_finding_count": 0,
      "record_id": "rar-train-00007"
    },
    {
      "blocked_reasons": [],
      "governance_fingerprint": "c552e7561b2b85ac3be1003c598a182b6c0115d96162acfbc7ab7de49d35e043",
      "passed": true,
      "pii_finding_count": 0,
      "record_id": "rar-train-00010"
    },
    {
      "blocked_reasons": [],
      "governance_fingerprint": "3e67b734db588087253a9b71cecbabc1246a4fb6cb89cf1812fb1576ae280a17",
      "passed": true,
      "pii_finding_count": 0,
      "record_id": "rar-train-00011"
    },
    {
      "blocked_reasons": [],
      "governance_fingerprint": "d00732c7e18b212b508aab87852e2e6b223fe222f42ede0ec3e2f9e02dd5027b",
      "passed": true,
      "pii_finding_count": 0,
      "record_id": "rar-train-00012"
    },
    {
      "blocked_reasons": [],
      "governance_fingerprint": "4344cec669a9836e41e42cc6ad65acd6b59c6330fa77622db85d0be91b717ac4",
      "passed": true,
      "pii_finding_count": 0,
      "record_id": "rar-train-00013"
    },
    {
      "blocked_reasons": [],
      "governance_fingerprint": "1bdef428e111e3dd956e933348e3a708af3f2103db613d6c4492f86fed574035",
      "passed": true,
      "pii_finding_count": 0,
      "record_id": "rar-train-00014"
    },
    {
      "blocked_reasons": [],
      "governance_fingerprint": "8c1f1dbd1f512a1298eb41046908d8d2e791b78f92c275b0f91f1d863395f930",
      "passed": true,
      "pii_finding_count": 0,
      "record_id": "rar-train-00015"
    },
    {
      "blocked_reasons": [],
      "governance_fingerprint": "2e7c9e362bfa4d6adb811c900e6e8e3cc97865b19fac3783cacee56736012516",
      "passed": true,
      "pii_finding_count": 0,
      "record_id": "rar-train-00016"
    },
    {
      "blocked_reasons": [],
      "governance_fingerprint": "81b62c9d6b502fb2cfc537c64439198ef0957b8d73072dcd830192b3c490ec51",
      "passed": true,
      "pii_finding_count": 0,
      "record_id": "rar-train-00017"
    },
    {
      "blocked_reasons": [],
      "governance_fingerprint": "de7e8415adbc3a2fb24e519e9f6e730d47d302b35114eea3d0e84830573b411a",
      "passed": true,
      "pii_finding_count": 0,
      "record_id": "rar-train-00020"
    },
    {
      "blocked_reasons": [],
      "governance_fingerprint": "a0f38b4e41748a20ce5072f059104988198c3fbb8e187795a0e151a82b8c4f7e",
      "passed": true,
      "pii_finding_count": 0,
      "record_id": "rar-train-00021"
    },
    {
      "blocked_reasons": [],
      "governance_fingerprint": "ea2c0e070fefc21bcd8e8bcd2a5aaa5de4e03f1eef474384063cb8f599d128df",
      "passed": true,
      "pii_finding_count": 0,
      "record_id": "rar-train-00022"
    },
    {
      "blocked_reasons": [],
      "governance_fingerprint": "94d35b470da005dc20af244cc91a29f1b04e4e098b1d28e9122e2af1680886ca",
      "passed": true,
      "pii_finding_count": 0,
      "record_id": "rar-train-00023"
    },
    {
      "blocked_reasons": [],
      "governance_fingerprint": "47820119d0662148938c52c226e6fbb173320671f4309f45711045fdcd62fc5d",
      "passed": true,
      "pii_finding_count": 0,
      "record_id": "rar-train-00024"
    },
    {
      "blocked_reasons": [],
      "governance_fingerprint": "cb28d835a84e815638270c2869a01573fe911542c03441d47d94303fb6937141",
      "passed": true,
      "pii_finding_count": 0,
      "record_id": "rar-train-00025"
    },
    {
      "blocked_reasons": [],
      "governance_fingerprint": "9ed9f2516dd391e720ec5b0ec4e93f6ef5505fc5b4a44806c3b6825432a34a27",
      "passed": true,
      "pii_finding_count": 0,
      "record_id": "rar-train-00026"
    },
    {
      "blocked_reasons": [],
      "governance_fingerprint": "8b6d8f2910b998d90a22631c7c9e124c834b23328edb09510a802bc1fd8e9e0a",
      "passed": true,
      "pii_finding_count": 0,
      "record_id": "rar-train-00027"
    },
    {
      "blocked_reasons": [],
      "governance_fingerprint": "82e324bfbda19cda08b73170b55d53ee6a6badf14b520632221449fd49b06637",
      "passed": true,
      "pii_finding_count": 0,
      "record_id": "rar-train-00030"
    },
    {
      "blocked_reasons": [],
      "governance_fingerprint": "5a81a6247d698084daaa6cc119b944531ce01b61642d154c5d8e9efc1e5b5545",
      "passed": true,
      "pii_finding_count": 0,
      "record_id": "rar-train-00031"
    },
    {
      "blocked_reasons": [],
      "governance_fingerprint": "d8069c0028414c5e1310b841f8451f742c4c4c5db73be17aa8c0337113580f9c",
      "passed": true,
      "pii_finding_count": 0,
      "record_id": "rar-train-00032"
    },
    {
      "blocked_reasons": [],
      "governance_fingerprint": "0c46c4495a68de997003a030e6e9a93d5ef67b416f2f1725a69132384a3a34fb",
      "passed": true,
      "pii_finding_count": 0,
      "record_id": "rar-train-00033"
    },
    {
      "blocked_reasons": [],
      "governance_fingerprint": "d430ba9663629e244a685f88d45e112e2306fcba4266f1741b0f4172d360223b",
      "passed": true,
      "pii_finding_count": 0,
      "record_id": "rar-train-00034"
    },
    {
      "blocked_reasons": [],
      "governance_fingerprint": "08bfbcf149fad68abb265cdc231c31ef7119b6e02c3518af8462bdbe3067b729",
      "passed": true,
      "pii_finding_count": 0,
      "record_id": "rar-train-00035"
    },
    {
      "blocked_reasons": [],
      "governance_fingerprint": "d009b57e985a948c27d964c46077f2f5e0823c8d338432c97a75c1c440565c49",
      "passed": true,
      "pii_finding_count": 0,
      "record_id": "rar-train-00036"
    },
    {
      "blocked_reasons": [],
      "governance_fingerprint": "0597442cca59a693645a85ba942c0b20bb69fdc03d137f234d17366360c062ec",
      "passed": true,
      "pii_finding_count": 0,
      "record_id": "rar-train-00037"
    },
    {
      "blocked_reasons": [],
      "governance_fingerprint": "d09ab012337c5fbff62c67a093e1f56197b864786f52154ad7b77a3d3d5dc4b1",
      "passed": true,
      "pii_finding_count": 0,
      "record_id": "rar-train-00040"
    },
    {
      "blocked_reasons": [],
      "governance_fingerprint": "12527639f19a1448d1729214a40a0b5f65cdd8b81d173aa85250717a88d08c05",
      "passed": true,
      "pii_finding_count": 0,
      "record_id": "rar-train-00041"
    },
    {
      "blocked_reasons": [],
      "governance_fingerprint": "e59df4e3f7b0dd89c4de7219cbeec3a5070aa87ab5c91b5bcd9bb51ed2a2d677",
      "passed": true,
      "pii_finding_count": 0,
      "record_id": "rar-train-00042"
    },
    {
      "blocked_reasons": [],
      "governance_fingerprint": "33b60c2caa289f03099fe9c06b102cdeb74e51c424a99bac1ae1b2f0851d2f57",
      "passed": true,
      "pii_finding_count": 0,
      "record_id": "rar-train-00043"
    },
    {
      "blocked_reasons": [],
      "governance_fingerprint": "2dbed06c76a57259f50ff5b531c935661625c242fd980e5d0cdc424b2bf09ec7",
      "passed": true,
      "pii_finding_count": 0,
      "record_id": "rar-train-00044"
    },
    {
      "blocked_reasons": [],
      "governance_fingerprint": "a0c6349a2ad9b6e3b4f79e39db36c3d77554d401adb39db542eb92b2805b58f9",
      "passed": true,
      "pii_finding_count": 0,
      "record_id": "rar-train-00045"
    },
    {
      "blocked_reasons": [],
      "governance_fingerprint": "ab318ae9ae3a11c91b065cdf16ce8e5229f8709a61fdc6fbdd73b2841f69e2f4",
      "passed": true,
      "pii_finding_count": 0,
      "record_id": "rar-train-00046"
    },
    {
      "blocked_reasons": [],